{
  "checkpoint": "I00",
  "product_version": "0.1.0-alpha.0",
  "generated_at_utc": "2026-09-18T23:27:46.180457Z",
  "overall_status": "GREEN",
  "review_mode": "sequential_role_review_no_parallel_agent_runtime",
  "gates": {
    "G0": "GREEN",
    "G1": "GREEN",
    "G6": "GREEN",
    "G8": "GREEN"
  },
  "fingerprint_sha256": "b4a13f2ecf17ac499e136b13696146f45d6371b9eadf9829a0838959696148a1",
  "tests": {
    "unit_tests": "PASS",
    "repository_validation": "PASS",
    "python_compile": "PASS"
  },
  "reviews": [
    {
      "role": "orchestrator",
      "status": "PASS",
      "evidence": "Scope I00, Merge-Hoheit und Freeze-Regeln definiert."
    },
    {
      "role": "architecture_guardian",
      "status": "PASS",
      "evidence": "Importgrenzen plus Positiv-/Negativfixture validiert."
    },
    {
      "role": "data_schema_auditor",
      "status": "PASS",
      "evidence": "Governance-Schemas nutzen Draft 2020-12; Versionsdimensionen getrennt."
    },
    {
      "role": "qa_regression",
      "status": "PASS",
      "evidence": "Unit-Tests, Negativfixture, Marker- und Versionsprüfungen ausgeführt."
    },
    {
      "role": "security_integrity",
      "status": "PASS",
      "evidence": "Trust-Boundary-/Fehlerregeln definiert; SHA-256-Evidence aktiv."
    },
    {
      "role": "ux_accessibility",
      "status": "PASS",
      "evidence": "WCAG-2.2-AA-Ziel und nutzerverständliche Fehleranforderungen dokumentiert."
    },
    {
      "role": "content_canon",
      "status": "PASS",
      "evidence": "Content bleibt außerhalb der Runtime-Logik; Kanonhoheit ist getrennt."
    },
    {
      "role": "release_evidence",
      "status": "PASS",
      "evidence": "SemVer, Changelog, Fingerprint, Status- und Evidence-Artefakte vorhanden."
    }
  ]
}
